{
  "schema": "commitwork.release-evidence/1",
  "product": "audiencedirect-site",
  "generated_at": "2026-10-22T10:00:00Z",
  "source": "ad-site-deploy@0123456789ab",
  "policy": {
    "name": "ad-release-gate",
    "kev": true,
    "critical": true,
    "high_epss_min": 0.1,
    "runtime_only": true,
    "keep_days": 90,
    "keep_min": 3,
    "verdict_max_age_hours": 48
  },
  "serving": "aaaaaaaaaaaaaaaaaaaaaaaaaaaaaaaaaaaaaaaa",
  "releases": [
    {
      "sha": "aaaaaaaaaaaaaaaaaaaaaaaaaaaaaaaaaaaaaaaa",
      "built_at": "2026-10-21T08:00:00Z",
      "state": "serving",
      "verdict": {
        "checked_at": "2026-10-22T09:00:00Z",
        "status": "clean",
        "blocking": [],
        "findings": [
          {
            "id": "GHSA-kev-0000-0002",
            "cves": [
              "CVE-2099-0002"
            ],
            "package": "quiet-lib",
            "version": "1.0.0",
            "runtime": true,
            "severity": "medium",
            "cvss": 6.1,
            "epss": null,
            "kev": false,
            "blocking": false,
            "reason": "no policy rule fires"
          }
        ],
        "unchecked": {
          "jsr": 3,
          "remote_hosts": [
            "esm.sh"
          ]
        },
        "kev_catalog": "2026.10.20"
      },
      "verdict_at": "2026-10-22T09:00:00Z",
      "inventory": {
        "npm": [
          {
            "name": "left-pad",
            "version": "1.0.0",
            "runtime": true,
            "source": "lock"
          }
        ],
        "jsr": [
          "@std/assert"
        ],
        "unchecked_remote": [
          "esm.sh"
        ]
      }
    }
  ],
  "events": [
    {
      "at": "2026-10-21T08:30:00Z",
      "event": "serving",
      "sha": "aaaaaaaaaaaaaaaaaaaaaaaaaaaaaaaaaaaaaaaa",
      "detail": null
    }
  ]
}
